{
  "chapter_id": "cp001",
  "passage_id": "p05",
  "page_id": "cp001-p05-page-01",
  "title_cn": "英雄与小人",
  "source_passage_spec_file": "spec.json",
  "source_scene_spec_files": [
    "s01-spec.json",
    "s02-spec.json",
    "s03-spec.json"
  ],
  "comic_goal_cn": "把 p05 做成一页五格连环画：颍川火光与曹操初亮相、槛车中的卢植、张飞欲劫囚被刘备拦下、三兄弟救董卓后遭白身之辱、张飞提刀欲回帐杀人。",
  "adaptation_rules": [
    "一格只讲一个清楚的动作瞬间",
    "第一格要先把战场之大和曹操亮相压缩在同一页开头",
    "第二格槛车中的卢植是全页最冷的一格——制度碾压感要立住",
    "第三格张飞欲劫囚、刘备拦刀是全页第一次爆点",
    "第四格救董卓后的'现居何职'是全页最屈辱的一格",
    "第五格张飞提刀要回帐杀董卓是全页真正的结尾爆点",
    "所有文字放在 frame 下方的文字区，不放在图里",
    "采用黑白小人书/连环画式速写插图",
    "不要把这一页做成战报拼贴，要始终围绕三兄弟的情绪推进"
  ],
  "page_format": {
    "panel_count": 5,
    "reading_direction": "ltr",
    "layout_pattern": "top-wide / upper-two / lower-two / bottom-wide"
  },
  "style": {
    "style_key": "bw_lianhuanhua_sketch",
    "prompt_cn": "黑白小人书/连环画式速写插图。这一页的重点不是纯战斗，而是英雄碰上权力世界时的屈辱。战场格要快，人物格要准，表情和动作都要干脆。人物大于环境，冲突大于背景。不要彩绘，不要海报感，不要摆拍，不要做成说明书式历史拼贴。",
    "negative_prompt": "full color, glossy poster, photorealistic rendering, stiff posed figures, rigid composition, over-rendered detail, game splash art, infographic collage, explanatory timeline poster, round-based combat, courtroom melodrama",
    "text_policy": "image_without_text + mobile_frame_text_blocks"
  },
  "panels": [
    {
      "panel_id": "p1",
      "scene_id": "cp001_p05_s1",
      "story_function": "setup",
      "moment_cn": "颍川方向火光冲天，三兄弟赶到时仗已打完；远处一彪军马截杀败军，为首正是曹操。",
      "camera_cn": "远景宽格，前景是三兄弟勒马远望，远处火光与曹操截杀败军同框。",
      "must_show": [
        "远处火光冲天",
        "三兄弟勒马高处远望",
        "败走的黄巾残兵",
        "曹操短而锐利的初次亮相"
      ],
      "must_avoid": [
        "展开火攻过程",
        "把曹操画成主角海报",
        "让三兄弟和曹操近距离互动"
      ],
      "image_prompt_cn": "颍川长社方向，远处火光冲天，喊杀声刚刚散下去。刘备、关羽、张飞勒马立在高处往下看，知道自己来晚了一步。更远处，一彪军马正截住败走的黄巾残兵，为首一将身量不高却极利落，细眼长髯，骑在马上挥兵截杀——那就是曹操。重点不是战斗细节，而是'战场很大，三兄弟只是刚刚赶到，而另一个英雄已经出手'的感觉。黑白小人书速写宽景，远近层次清楚，火光、败军、截杀三者都要在一张图里。",
      "text_slots": [
        {
          "id": "p1_d1",
          "speaker": "narrator",
          "text_cn": "颍川火光冲天。三兄弟赶到时，仗已经打完了。远处又一彪军马截杀败兵，为首一人，正是骑都尉曹操。",
          "kind": "caption"
        }
      ]
    },
    {
      "panel_id": "p2",
      "scene_id": "cp001_p05_s2",
      "story_function": "turn",
      "moment_cn": "半路槛车迎面而来，车里坐着卢植。",
      "camera_cn": "中景，槛车占画面中心，刘备下马趋前。",
      "must_show": [
        "槛车",
        "卢植在车中端坐",
        "刘备大惊下马",
        "押送军士在旁"
      ],
      "must_avoid": [
        "把卢植画得哭诉狼狈",
        "把画面做成审判戏",
        "塞满多余道具"
      ],
      "image_prompt_cn": "广宗方向半路上，一辆槛车迎面而来。车中坐着卢植，衣冠未乱，神色克制，却已经成了囚徒。刘备大惊失色，急忙翻身下马上前相问。押送军士骑马护在两侧。重点是'好人被制度关进囚车'的那一瞬间冲击。黑白小人书速写中景，槛车必须是视觉中心，卢植的克制和刘备的惊愕形成对照。",
      "text_slots": [
        {
          "id": "p2_d1",
          "speaker": "narrator",
          "text_cn": "半路一辆槛车迎面而来。车里坐的，竟是卢植。",
          "kind": "caption"
        }
      ]
    },
    {
      "panel_id": "p3",
      "scene_id": "cp001_p05_s2",
      "story_function": "pressure",
      "moment_cn": "张飞怒拔刀要劫囚，刘备伸手拦住。",
      "camera_cn": "动态中景，刀刚出鞘，刘备伸臂拦住，关羽在后沉着看着。",
      "must_show": [
        "张飞怒拔刀",
        "刘备伸手制止",
        "关羽在旁但不冲动",
        "槛车正被押走"
      ],
      "must_avoid": [
        "让张飞真的砍下去",
        "让刘备跟着发怒",
        "把关羽画成旁观木头人"
      ],
      "image_prompt_cn": "听完卢植被诬陷的原委，张飞勃然大怒，刀已经拔出半截，要冲过去砍押送的军士把卢植救下来。刘备一把伸手拦住他，神情极忍，嘴上是'朝廷自有公论，不可造次'。关羽站在后侧，脸色沉下来，但没有跟着冲动。槛车已经开始远去。重点是张飞的怒、刘备的忍、关羽的沉。黑白小人书速写，动作必须紧，刀和手臂的关系要清楚。",
      "text_slots": [
        {
          "id": "p3_d1",
          "speaker": "zhang_fei",
          "text_cn": "待我杀了这些人，救出老师！",
          "kind": "speech"
        },
        {
          "id": "p3_d2",
          "speaker": "liu_bei",
          "text_cn": "不可造次。朝廷自有公论。",
          "kind": "speech"
        }
      ]
    },
    {
      "panel_id": "p4",
      "scene_id": "cp001_p05_s3",
      "story_function": "core_humiliation",
      "moment_cn": "三兄弟浴血救回董卓，董卓只问：现居何职？刘备答：白身。董卓当场轻慢。",
      "camera_cn": "中景，帐中站位清楚，董卓高坐或立于前，刘备在下答话，关张在后。",
      "must_show": [
        "董卓刚被救回营寨",
        "刘备答话时克制",
        "董卓听见白身后脸色一变",
        "关羽张飞站在刘备身后"
      ],
      "must_avoid": [
        "展开救董卓的战斗过程",
        "把董卓画成咆哮反派",
        "让刘备失态"
      ],
      "image_prompt_cn": "军寨帐中，刚被救回来的董卓喘息未定，先打量三兄弟。刘备上前回话，神情克制，身上还有厮杀后的狼狈。董卓听见刘备说自己'现居白身'，脸色一冷，原本该有的礼数立刻收了回去。关羽和张飞站在刘备身后，一个沉住气，一个已经压不住怒。重点是'拼命救了人，换来的却是一句轻视'。黑白小人书速写中景，站位一定要清楚，董卓的轻慢必须从表情和姿态里出来。",
      "text_slots": [
        {
          "id": "p4_d1",
          "speaker": "dong_zhuo",
          "text_cn": "现居何职？",
          "kind": "speech"
        },
        {
          "id": "p4_d2",
          "speaker": "liu_bei",
          "text_cn": "白身。",
          "kind": "speech"
        }
      ]
    },
    {
      "panel_id": "p5",
      "scene_id": "cp001_p05_s3",
      "story_function": "hook",
      "moment_cn": "三人出帐，张飞提刀转身就要回去杀董卓，刘备关羽同时去拦。",
      "camera_cn": "横向收束格，张飞在前猛回身，刀已提起，刘备和关羽在后追拦。",
      "must_show": [
        "张飞提刀回身",
        "刘备在后急拦",
        "关羽也跟上",
        "帐门还在身后"
      ],
      "must_avoid": [
        "当场把董卓杀掉",
        "把怒火处理成滑稽",
        "让结尾泄劲"
      ],
      "image_prompt_cn": "三人刚出帐，张飞再也压不住，提起刀转身就要杀回去，嘴里骂着'亲赴血战救了这厮，他却如此无礼'。刘备立刻伸手去拦，关羽也一步跟上。帐门就在身后，下一瞬间就可能出大事。重点是这一刀举到半空的爆点——全章的委屈、怒火、白身之辱都在这一瞬间炸开。黑白小人书速写收束格，动作大，情绪满，但不能真的落刀。",
      "text_slots": [
        {
          "id": "p5_d1",
          "speaker": "zhang_fei",
          "text_cn": "亲赴血战救了这厮，他却如此无礼！不杀他，难消我气！",
          "kind": "speech"
        }
      ]
    }
  ]
}
