{
  "chapter_id": "cp001",
  "passage_id": "p05",
  "page_id": "cp001-p05-page-01",
  "title_cn": "英雄与小人",
  "source_passage_spec_file": "spec.json",
  "source_scene_spec_files": [
    "s01-spec.json",
    "s02-spec.json",
    "s03-spec.json"
  ],
  "comic_goal_cn": "把 p05 做成一页五格连环画：颍川火光与曹操初亮相、曹操与三兄弟短短相看、槛车中的卢植、张飞欲劫囚被刘备拦下、槛车远去后三兄弟带着怒气转回涿郡。",
  "adaptation_rules": [
    "一格只讲一个清楚的动作瞬间",
    "第一格先立住战场之大和曹操初亮相",
    "第二格给曹操一个短而锐利的人物互动，不展开，不传记化",
    "第三格槛车中的卢植是全页最冷的一格——制度碾压感要立住",
    "第四格张飞拔刀、刘备拦刀是全页最大的动作爆点",
    "第五格不再塞董卓，改成槛车远去后的冷收束，让怒气悬着",
    "所有文字放在 frame 下方的文字区，不放在图里",
    "采用黑白小人书/连环画式速写插图",
    "不要把这一页做成战报拼贴，要始终围绕三兄弟的情绪推进"
  ],
  "page_format": {
    "panel_count": 5,
    "reading_direction": "ltr",
    "layout_pattern": "top-wide / upper-two / lower-two / bottom-wide"
  },
  "style": {
    "style_key": "bw_lianhuanhua_sketch",
    "prompt_cn": "黑白小人书/连环画式速写插图。这一页的重点不是纯战斗，而是英雄第一次碰见更大的战场、更大的英雄、也碰见制度对好人的碾压。战场格要快，人物格要准，表情和动作都要干脆。人物大于环境，冲突大于背景。不要彩绘，不要海报感，不要摆拍，不要做成说明书式历史拼贴。",
    "negative_prompt": "full color, glossy poster, photorealistic rendering, stiff posed figures, rigid composition, over-rendered detail, game splash art, infographic collage, explanatory timeline poster, round-based combat, courtroom melodrama",
    "text_policy": "image_without_text + mobile_frame_text_blocks"
  },
  "panels": [
    {
      "panel_id": "p1",
      "scene_id": "cp001_p05_s1",
      "story_function": "setup",
      "moment_cn": "颍川方向火光冲天，三兄弟赶到时仗已打完；远处一彪军马截杀败军，为首正是曹操。",
      "camera_cn": "远景宽格，前景是三兄弟勒马远望，远处火光与曹操截杀败军同框。",
      "must_show": [
        "远处火光冲天",
        "三兄弟勒马高处远望",
        "败走的黄巾残兵",
        "曹操短而锐利的初次亮相"
      ],
      "must_avoid": [
        "展开火攻过程",
        "把曹操画成主角海报",
        "让三兄弟和曹操近距离互动"
      ],
      "image_prompt_cn": "颍川长社方向，远处火光冲天，喊杀声刚刚散下去。刘备、关羽、张飞勒马立在高处往下看，知道自己来晚了一步。更远处，一彪军马正截住败走的黄巾残兵，为首一将身量不高却极利落，细眼长髯，骑在马上挥兵截杀——那就是曹操。重点不是战斗细节，而是'战场很大，三兄弟只是刚刚赶到，而另一个英雄已经出手'的感觉。黑白小人书速写宽景，远近层次清楚，火光、败军、截杀三者都要在一张图里。",
      "text_slots": [
        {
          "id": "p1_d1",
          "speaker": "narrator",
          "text_cn": "颍川火光冲天。三兄弟赶到时，仗已经打完了。远处又一彪军马截杀败兵，为首一人，正是骑都尉曹操。",
          "kind": "caption"
        }
      ]
    },
    {
      "panel_id": "p2",
      "scene_id": "cp001_p05_s1",
      "story_function": "new_hero_glance",
      "moment_cn": "营前短短相看——曹操勒马收缰，从三兄弟身边经过，彼此记住了对方。",
      "camera_cn": "中景，曹操骑马偏前经过，刘备在地面回望，关张在侧，皇甫嵩军营作背景。",
      "must_show": [
        "曹操勒马经过",
        "刘备回望曹操",
        "关羽张飞也在旁边",
        "短而锐利的擦肩感"
      ],
      "must_avoid": [
        "让曹操和三兄弟长谈",
        "展开曹操背景传记",
        "把曹操画得喧宾夺主"
      ],
      "image_prompt_cn": "皇甫嵩军营前，战事刚歇。曹操勒住马，从三兄弟身边经过，身上还带着刚截杀败军的利气。他回头扫了刘备一眼，刘备也正抬眼看他。关羽和张飞站在一旁，知道这不是普通人。皇甫嵩或朱儁在旁点出一句：张梁张宝必投广宗，你们快去助卢植。重点是'两种英雄第一次短短相看'——不长谈，只留印象。黑白小人书速写中景，人物关系清楚，曹操不能喧宾夺主，但必须让人记住。",
      "text_slots": [
        {
          "id": "p2_d1",
          "speaker": "narrator",
          "text_cn": "曹操只从他们身边扫过一眼。皇甫嵩道：张梁张宝必投广宗，你们星夜回去助卢植。",
          "kind": "caption"
        }
      ]
    },
    {
      "panel_id": "p3",
      "scene_id": "cp001_p05_s2",
      "story_function": "turn",
      "moment_cn": "半路槛车迎面而来，车里坐着卢植。",
      "camera_cn": "中景，槛车占画面中心，刘备下马趋前。",
      "must_show": [
        "槛车",
        "卢植在车中端坐",
        "刘备大惊下马",
        "押送军士在旁"
      ],
      "must_avoid": [
        "把卢植画得哭诉狼狈",
        "把画面做成审判戏",
        "塞满多余道具"
      ],
      "image_prompt_cn": "广宗方向半路上，一辆槛车迎面而来。车中坐着卢植，衣冠未乱，神色克制，却已经成了囚徒。刘备大惊失色，急忙翻身下马上前相问。押送军士骑马护在两侧。重点是'好人被制度关进囚车'的那一瞬间冲击。黑白小人书速写中景，槛车必须是视觉中心，卢植的克制和刘备的惊愕形成对照。",
      "text_slots": [
        {
          "id": "p3_d1",
          "speaker": "narrator",
          "text_cn": "半路一辆槛车迎面而来。车里坐的，竟是卢植。",
          "kind": "caption"
        }
      ]
    },
    {
      "panel_id": "p4",
      "scene_id": "cp001_p05_s2",
      "story_function": "pressure",
      "moment_cn": "听完蒙冤原委，张飞怒拔刀要劫囚，刘备伸手拦住，关羽在后沉着不语。",
      "camera_cn": "动态中景，刀刚出鞘，刘备伸臂拦住，卢植仍在车中，槛车缓缓前行。",
      "must_show": [
        "张飞怒拔刀",
        "刘备伸手制止",
        "关羽在旁但不冲动",
        "槛车正被押走"
      ],
      "must_avoid": [
        "让张飞真的砍下去",
        "让刘备跟着发怒",
        "把关羽画成旁观木头人"
      ],
      "image_prompt_cn": "听完卢植被诬陷的原委，张飞勃然大怒，刀已经拔出半截，要冲过去砍押送的军士把卢植救下来。刘备一把伸手拦住他，神情极忍，嘴上是'朝廷自有公论，不可造次'。关羽站在后侧，脸色沉下来，但没有跟着冲动。卢植仍坐在车中，槛车已经开始远去。重点是张飞的怒、刘备的忍、关羽的沉。黑白小人书速写，动作必须紧，刀和手臂的关系要清楚。",
      "text_slots": [
        {
          "id": "p4_d1",
          "speaker": "zhang_fei",
          "text_cn": "待我杀了这些人，救出老师！",
          "kind": "speech"
        },
        {
          "id": "p4_d2",
          "speaker": "liu_bei",
          "text_cn": "不可造次。朝廷自有公论。",
          "kind": "speech"
        }
      ]
    },
    {
      "panel_id": "p5",
      "scene_id": "cp001_p05_s2",
      "story_function": "closure",
      "moment_cn": "槛车远去，三兄弟立在路边望着尘土，怒气未消，关羽低声劝回涿郡。",
      "camera_cn": "横向收束格，槛车远去成小影，三兄弟站在前景，张飞仍握刀未平，刘备沉默，关羽侧身劝言。",
      "must_show": [
        "槛车远去",
        "张飞怒气未平",
        "刘备沉默忍住",
        "关羽劝回涿郡"
      ],
      "must_avoid": [
        "把收束做成泄气散场",
        "让张飞滑稽化",
        "把情绪收得太平"
      ],
      "image_prompt_cn": "槛车渐渐远去，只剩路上的尘土。三兄弟站在道旁，张飞手里还攥着刀，怒气未消；刘备望着远去的槛车，沉默不语；关羽侧过身来，低声劝道：卢中郎已去，别人领兵我们无所依，不如先回涿郡。重点是这一页的冷收束——怒没有发出去，委屈也没有消，只能先咽下去。黑白小人书速写横向收束格，人物情绪要压住但不能泄掉。",
      "text_slots": [
        {
          "id": "p5_d1",
          "speaker": "guan_yu",
          "text_cn": "卢中郎已去，别人领兵我们无所依，不如先回涿郡。",
          "kind": "speech"
        }
      ]
    }
  ]
}
