{
  "chapter_id": "cp001",
  "passage_id": "p02",
  "page_id": "cp001-p02-page-01",
  "title_cn": "英雄叹息",
  "source_passage_spec_file": "spec.json",
  "source_scene_spec_files": [
    "s01-spec.json",
    "s02-spec.json",
    "s03-spec.json"
  ],
  "comic_goal_cn": "把 p02 做成一页四格连环画，让读者在一页内读清刘备的不凡与落魄、榜前长叹的压抑、以及张飞把叹息变成行动的瞬间。",
  "adaptation_rules": [
    "一格只讲一个清楚的动作瞬间",
    "第二格榜前长叹是全页情绪中心",
    "第三格张飞厉喝是全页动作爆点",
    "所有文字放在 frame 下方的文字区，不放在图里",
    "采用黑白小人书/连环画式速写插图",
    "内容少而精，突出人物和故事推进"
  ],
  "page_format": {
    "panel_count": 4,
    "reading_direction": "ltr",
    "layout_pattern": "top-two / middle-wide / bottom-wide"
  },
  "style": {
    "style_key": "bw_lianhuanhua_sketch",
    "prompt_cn": "黑白小人书/连环画式速写插图。线条可以细，但必须有动势和呼吸感。人物动作鲜活，故事瞬间清楚，人物大于景物，背景从简。不要彩绘，不要海报感，不要摆拍。",
    "negative_prompt": "full color, glossy poster, photorealistic rendering, stiff posed figures, rigid composition, over-rendered detail, game splash art, palace luxury, infographic collage",
    "text_policy": "image_without_text + mobile_frame_text_blocks"
  },
  "panels": [
    {
      "panel_id": "p1",
      "scene_id": "cp001_p02_s1",
      "story_function": "setup",
      "moment_cn": "楼桑树下的少年刘备，贵气种子与贫苦现实同时立住。",
      "camera_cn": "中景偏叙事，人物与楼桑树同框。",
      "must_show": [
        "少年刘备",
        "楼桑大树",
        "不凡但贫苦的底色"
      ],
      "must_avoid": [
        "做成儿童插画",
        "细讲家谱和私塾细节"
      ],
      "image_prompt_cn": "楼桑树下的少年刘备站在树荫里，抬头望着像车盖一样撑开的桑树树冠。重点是把这个人未来的不凡和眼下的贫苦同时立住。黑白小人书速写插图，人物大于景物，气质沉稳，不要做成童话感，不要把画面塞满背景细节。",
      "text_slots": [
        {
          "id": "p1_d1",
          "speaker": "narrator",
          "text_cn": "刘备虽是中山靖王之后，却家贫贩屦织席。",
          "kind": "caption"
        }
      ]
    },
    {
      "panel_id": "p2",
      "scene_id": "cp001_p02_s2",
      "story_function": "pressure",
      "moment_cn": "二十八岁的刘备站在榜前长叹。",
      "camera_cn": "中景，榜文与刘备同框。",
      "must_show": [
        "刘备站在榜前",
        "慨然长叹",
        "周围人各忙各的"
      ],
      "must_avoid": [
        "把叹息画成软弱",
        "过度拥挤的街景"
      ],
      "image_prompt_cn": "二十八岁的刘备站在招兵榜前，一个字一个字看完，最后长叹一声。重点不是怕，而是胸中有志却手上无力。周围卖菜、挑担、赶驴的人照常经过，更衬出他的孤独。黑白小人书速写主镜头，人物表情和叹息动作要立住，背景从简。",
      "text_slots": [
        {
          "id": "p2_d1",
          "speaker": "narrator",
          "text_cn": "他叹的不是怕死，是恨自己有志无力。",
          "kind": "caption"
        }
      ]
    },
    {
      "panel_id": "p3",
      "scene_id": "cp001_p02_s3",
      "story_function": "reveal",
      "moment_cn": "张飞厉声一喝，打破沉寂。",
      "camera_cn": "动态中景，张飞闯入画面。",
      "must_show": [
        "张飞豹头环眼",
        "声若巨雷的动作感",
        "刘备转头看他"
      ],
      "must_avoid": [
        "把张飞画成莽夫怪相"
      ],
      "image_prompt_cn": "刘备叹息之后，身后突然炸开一声厉喝。张飞闯入画面，豹头环眼，气势逼人，但不是滑稽莽夫。刘备转头看他，两个人第一次真正对上。重点是张飞把沉闷局面一下子击碎。黑白小人书速写插图，动作感强，人物冲突立起来。",
      "text_slots": [
        {
          "id": "p3_d1",
          "speaker": "zhang_fei",
          "text_cn": "大丈夫不与国家出力，何故长叹？",
          "kind": "speech"
        }
      ]
    },
    {
      "panel_id": "p4",
      "scene_id": "cp001_p02_s3",
      "story_function": "hook",
      "moment_cn": "二人说定出资招兵，同入村店饮酒，门口影子一动。",
      "camera_cn": "收束镜头，店门与门口影子形成尾钩。",
      "must_show": [
        "刘备与张飞并肩入店",
        "店门口的影子",
        "下一幕将有人登场的钩子"
      ],
      "must_avoid": [
        "过早露出关羽正脸"
      ],
      "image_prompt_cn": "刘备与张飞说定招募乡勇，二人并肩走进村店。店里酒未上，门口影子先动了一下。重点是行动已经开始，而第三个人马上要来。黑白小人书收束镜头，故事钩子要清楚，门口影子只点到，不露真容。",
      "text_slots": [
        {
          "id": "p4_d1",
          "speaker": "zhang_fei",
          "text_cn": "我颇有资财，当招募乡勇，与公同举大事。",
          "kind": "speech"
        },
        {
          "id": "p4_d2",
          "speaker": "narrator",
          "text_cn": "酒还没上来，门口的影子先动了。",
          "kind": "caption"
        }
      ]
    }
  ]
}
