{
  "chapter_id": "cp001",
  "passage_id": "p03",
  "page_id": "cp001-p03-page-01",
  "title_cn": "桃园结义",
  "source_passage_spec_file": "spec.json",
  "source_scene_spec_files": [
    "s01-spec.json",
    "s02-spec.json",
    "s03-spec.json"
  ],
  "comic_goal_cn": "把 p03 做成一页四格连环画，让读者在一页内读清关羽登场、三兄弟结义、结义后立刻成军并上路。",
  "adaptation_rules": [
    "一格只讲一个清楚的动作瞬间",
    "第二格桃园结义是全页视觉中心",
    "所有文字放在 frame 下方的文字区，不放在图里",
    "采用黑白小人书/连环画式速写插图",
    "内容少而精，突出人物和故事推进"
  ],
  "page_format": {
    "panel_count": 4,
    "reading_direction": "ltr",
    "layout_pattern": "top-two / middle-wide / bottom-wide"
  },
  "style": {
    "style_key": "bw_lianhuanhua_sketch",
    "prompt_cn": "黑白小人书/连环画式速写插图。线条可以细，但必须有动势和呼吸感。人物动作鲜活，故事瞬间清楚，人物大于景物，背景从简。不要彩绘，不要海报感，不要摆拍。",
    "negative_prompt": "full color, glossy poster, photorealistic rendering, stiff posed figures, rigid composition, over-rendered detail, game splash art, palace luxury, infographic collage",
    "text_policy": "image_without_text + mobile_frame_text_blocks"
  },
  "panels": [
    {
      "panel_id": "p1",
      "scene_id": "cp001_p03_s1",
      "story_function": "reveal",
      "moment_cn": "关羽推车入店，刘备起身相看，张飞也被吸引。",
      "camera_cn": "中景，门口斜切入画。",
      "must_show": [
        "关羽高大入门",
        "刘备起身",
        "张飞在旁前倾"
      ],
      "must_avoid": [
        "酒馆背景过满",
        "把重点放成店内杂物"
      ],
      "image_prompt_cn": "涿县村店里，一个高大的汉子推车到门外，转身大步进门，要快喝一碗酒就去投军。刘备在桌边起身看他，张飞坐在一旁也被吸引。重点是三个人第一次见面就认出彼此是一路人的那个瞬间。黑白小人书速写风，细线或中细线勾人物，线条活，像一气呵成画出来的叙事插图。人物比环境更重要，动作和神情要有代入感，不要复杂背景，不要彩绘海报感，不要僵硬站桩。",
      "text_slots": [
        {
          "id": "p1_d1",
          "speaker": "guan_yu",
          "text_cn": "快上一碗酒，我还得进城投军。",
          "kind": "speech"
        },
        {
          "id": "p1_d2",
          "speaker": "liu_bei",
          "text_cn": "壮士，不嫌弃的话，坐下一起喝一杯？",
          "kind": "speech"
        }
      ]
    },
    {
      "panel_id": "p2",
      "scene_id": "cp001_p03_s2",
      "story_function": "core_oath",
      "moment_cn": "三人面对天地焚香跪拜，正式结为兄弟。",
      "camera_cn": "中远景，稳定正面构图。",
      "must_show": [
        "刘备居中",
        "关羽沉稳",
        "张飞最有热气",
        "简朴香案"
      ],
      "must_avoid": [
        "桃花喧宾夺主",
        "仪式感过度华丽"
      ],
      "image_prompt_cn": "桃园里，刘备、关羽、张飞三人面对天地焚香跪拜，正式结为兄弟。重点是他们把命运绑在一起的那一刻。人物关系要清楚，刘备居中承担，关羽沉稳压场，张飞最有热气。黑白小人书速写主视觉，线条可以细，但要灵活有力，像老连环画里抓住关键动作和神情的一页。人物大于景物，桃花和祭礼只做必要点缀，内容少而精，突出故事性，不要唯美花海，不要华丽祭典，不要摆拍感。",
      "text_slots": [
        {
          "id": "p2_d1",
          "speaker": "narrator",
          "text_cn": "我三人今日结为兄弟。",
          "kind": "caption"
        },
        {
          "id": "p2_d2",
          "speaker": "all",
          "text_cn": "不求同生，但求同死。",
          "kind": "speech"
        }
      ]
    },
    {
      "panel_id": "p3",
      "scene_id": "cp001_p03_s3",
      "story_function": "momentum",
      "moment_cn": "好马进庄，三兄弟一下子有了成军气象。",
      "camera_cn": "横向宽格，中景偏广。",
      "must_show": [
        "马队进庄",
        "刘备接势",
        "关羽试刀",
        "张飞执矛"
      ],
      "must_avoid": [
        "解释流程式拼贴"
      ],
      "image_prompt_cn": "张飞庄院外，好马进庄，三兄弟一下子有了成军的样子。刘备在前接住这股势头，关羽试刀，张飞执矛，马群和乡勇让画面动起来。重点是从草莽三人变成一支队伍的起势瞬间。黑白小人书速写插图，线条有快感和动势，人物动作要带气，画面像故事正在发生，不是排队站好给人看。人物和故事性优先，背景从简，不做流程说明图，不做复杂拼贴。",
      "text_slots": [
        {
          "id": "p3_d1",
          "speaker": "merchant",
          "text_cn": "良马五十匹，金银五百两，镔铁一千斤，都送你们。",
          "kind": "speech"
        }
      ]
    },
    {
      "panel_id": "p4",
      "scene_id": "cp001_p03_s3",
      "story_function": "closure",
      "moment_cn": "三兄弟带着乡勇正式上路。",
      "camera_cn": "横向收束镜头。",
      "must_show": [
        "三兄弟披甲持兵",
        "乡勇跟随",
        "明确的出发感"
      ],
      "must_avoid": [
        "像阅兵照",
        "人群杂乱无中心"
      ],
      "image_prompt_cn": "三兄弟带着乡勇正式上路。刘备在前，关羽与张飞左右相随，队伍向前。重点是他们从结义兄弟变成真正上路的人。黑白小人书速写收束镜头，线条轻快但有力量，人物关系清楚，背景从简，突出出发感和故事收束感。",
      "text_slots": [
        {
          "id": "p4_d1",
          "speaker": "narrator",
          "text_cn": "从此，三兄弟带着队伍上路了。",
          "kind": "caption"
        }
      ]
    }
  ]
}
